{
  "schema_version": "affetta.job.v1",
  "request_id": "req_01K1A2B3C4D5E6F7G8H9J0K1M2",
  "idempotency_key": "s3db-order-2026-000184-line-1",
  "source": "stampa3dbologna",
  "operation": "slice",
  "created_at": "2026-08-02T03:10:00Z",
  "input": {
    "artifact_id": "art_01K1A2B3C4D5E6F7G8H9J0K1M3",
    "filename": "supporto.stl",
    "format": "stl",
    "sha256": "aaaaaaaaaaaaaaaaaaaaaaaaaaaaaaaaaaaaaaaaaaaaaaaaaaaaaaaaaaaaaaaa",
    "size_bytes": 1843220,
    "units": "millimeter"
  },
  "print_intent": {
    "material_id": "petg",
    "quality_id": "standard",
    "strength_id": "strong",
    "color_id": "black",
    "quantity": 2
  },
  "routing": {
    "mode": "automatic",
    "require_production_ready": true
  }
}
